{
  "$schema": "../../schemas/server-package-catalog.schema.json",
  "version": 1,
  "bundleId": "wave-d-2026-04-08",
  "wave": "wave-d",
  "artifact": "server-package-catalog",
  "state": "template_only_pending_build",
  "updatedAt": "2026-04-17",
  "packageArtifacts": [
    {
      "id": "linux-tar-gz",
      "platform": "linux",
      "packageType": "tar.gz",
      "fileNameTemplate": "craw-chat-server-linux-x86_64.tar.gz",
      "artifactPath": "artifacts/releases/wave-d-2026-04-08/server/packages/linux/artifacts/craw-chat-server-linux-x86_64.tar.gz",
      "installModel": "archive",
      "defaultInstallRoot": "/opt/craw-chat",
      "configRoot": "/etc/craw-chat/default",
      "dataRoot": "/var/lib/craw-chat/default",
      "logRoot": "/var/log/craw-chat/default",
      "runRoot": "/var/run/craw-chat/default",
      "serviceManager": "systemd",
      "startupCommand": "craw-chat-server --config <config-root>/server.yaml",
      "layoutTreePath": "artifacts/releases/wave-d-2026-04-08/server/packages/linux/artifacts/layout-tree.txt",
      "stagingReadmePath": "artifacts/releases/wave-d-2026-04-08/server/packages/linux/artifacts/README.md",
      "releaseChecklistPath": "artifacts/releases/wave-d-2026-04-08/server/packages/release-checklist.md",
      "checksumManifestPath": "artifacts/releases/wave-d-2026-04-08/server/packages/SHA256SUMS",
      "acceptanceManifestPath": "artifacts/releases/wave-d-2026-04-08/server/packages/linux/artifacts/acceptance-manifest.json",
      "state": "template_only_pending_build"
    },
    {
      "id": "linux-deb",
      "platform": "linux",
      "packageType": "deb",
      "fileNameTemplate": "craw-chat-server_<version>_amd64.deb",
      "artifactPath": "artifacts/releases/wave-d-2026-04-08/server/packages/linux/artifacts/craw-chat-server_<version>_amd64.deb",
      "installModel": "native-installer",
      "defaultInstallRoot": "/opt/craw-chat",
      "configRoot": "/etc/craw-chat/default",
      "dataRoot": "/var/lib/craw-chat/default",
      "logRoot": "/var/log/craw-chat/default",
      "runRoot": "/var/run/craw-chat/default",
      "serviceManager": "systemd",
      "startupCommand": "craw-chat-server --config <config-root>/server.yaml",
      "layoutTreePath": "artifacts/releases/wave-d-2026-04-08/server/packages/linux/artifacts/layout-tree.txt",
      "stagingReadmePath": "artifacts/releases/wave-d-2026-04-08/server/packages/linux/artifacts/README.md",
      "releaseChecklistPath": "artifacts/releases/wave-d-2026-04-08/server/packages/release-checklist.md",
      "checksumManifestPath": "artifacts/releases/wave-d-2026-04-08/server/packages/SHA256SUMS",
      "acceptanceManifestPath": "artifacts/releases/wave-d-2026-04-08/server/packages/linux/artifacts/acceptance-manifest.json",
      "state": "template_only_pending_build"
    },
    {
      "id": "linux-rpm",
      "platform": "linux",
      "packageType": "rpm",
      "fileNameTemplate": "craw-chat-server-<version>-1.x86_64.rpm",
      "artifactPath": "artifacts/releases/wave-d-2026-04-08/server/packages/linux/artifacts/craw-chat-server-<version>-1.x86_64.rpm",
      "installModel": "native-installer",
      "defaultInstallRoot": "/opt/craw-chat",
      "configRoot": "/etc/craw-chat/default",
      "dataRoot": "/var/lib/craw-chat/default",
      "logRoot": "/var/log/craw-chat/default",
      "runRoot": "/var/run/craw-chat/default",
      "serviceManager": "systemd",
      "startupCommand": "craw-chat-server --config <config-root>/server.yaml",
      "layoutTreePath": "artifacts/releases/wave-d-2026-04-08/server/packages/linux/artifacts/layout-tree.txt",
      "stagingReadmePath": "artifacts/releases/wave-d-2026-04-08/server/packages/linux/artifacts/README.md",
      "releaseChecklistPath": "artifacts/releases/wave-d-2026-04-08/server/packages/release-checklist.md",
      "checksumManifestPath": "artifacts/releases/wave-d-2026-04-08/server/packages/SHA256SUMS",
      "acceptanceManifestPath": "artifacts/releases/wave-d-2026-04-08/server/packages/linux/artifacts/acceptance-manifest.json",
      "state": "template_only_pending_build"
    },
    {
      "id": "macos-tar-gz",
      "platform": "macos",
      "packageType": "tar.gz",
      "fileNameTemplate": "craw-chat-server-darwin-universal.tar.gz",
      "artifactPath": "artifacts/releases/wave-d-2026-04-08/server/packages/macos/artifacts/craw-chat-server-darwin-universal.tar.gz",
      "installModel": "archive",
      "defaultInstallRoot": "/opt/craw-chat",
      "configRoot": "/etc/craw-chat/default",
      "dataRoot": "/var/lib/craw-chat/default",
      "logRoot": "/var/log/craw-chat/default",
      "runRoot": "/var/run/craw-chat/default",
      "serviceManager": "launchd",
      "startupCommand": "craw-chat-server --config <config-root>/server.yaml",
      "layoutTreePath": "artifacts/releases/wave-d-2026-04-08/server/packages/macos/artifacts/layout-tree.txt",
      "stagingReadmePath": "artifacts/releases/wave-d-2026-04-08/server/packages/macos/artifacts/README.md",
      "releaseChecklistPath": "artifacts/releases/wave-d-2026-04-08/server/packages/release-checklist.md",
      "checksumManifestPath": "artifacts/releases/wave-d-2026-04-08/server/packages/SHA256SUMS",
      "acceptanceManifestPath": "artifacts/releases/wave-d-2026-04-08/server/packages/macos/artifacts/acceptance-manifest.json",
      "state": "template_only_pending_build"
    },
    {
      "id": "macos-pkg",
      "platform": "macos",
      "packageType": "pkg",
      "fileNameTemplate": "craw-chat-server-<version>.pkg",
      "artifactPath": "artifacts/releases/wave-d-2026-04-08/server/packages/macos/artifacts/craw-chat-server-<version>.pkg",
      "installModel": "native-installer",
      "defaultInstallRoot": "/opt/craw-chat",
      "configRoot": "/etc/craw-chat/default",
      "dataRoot": "/var/lib/craw-chat/default",
      "logRoot": "/var/log/craw-chat/default",
      "runRoot": "/var/run/craw-chat/default",
      "serviceManager": "launchd",
      "startupCommand": "craw-chat-server --config <config-root>/server.yaml",
      "layoutTreePath": "artifacts/releases/wave-d-2026-04-08/server/packages/macos/artifacts/layout-tree.txt",
      "stagingReadmePath": "artifacts/releases/wave-d-2026-04-08/server/packages/macos/artifacts/README.md",
      "releaseChecklistPath": "artifacts/releases/wave-d-2026-04-08/server/packages/release-checklist.md",
      "checksumManifestPath": "artifacts/releases/wave-d-2026-04-08/server/packages/SHA256SUMS",
      "acceptanceManifestPath": "artifacts/releases/wave-d-2026-04-08/server/packages/macos/artifacts/acceptance-manifest.json",
      "state": "template_only_pending_build"
    },
    {
      "id": "windows-zip",
      "platform": "windows",
      "packageType": "zip",
      "fileNameTemplate": "craw-chat-server-windows-x86_64.zip",
      "artifactPath": "artifacts/releases/wave-d-2026-04-08/server/packages/windows/artifacts/craw-chat-server-windows-x86_64.zip",
      "installModel": "archive",
      "defaultInstallRoot": "%ProgramFiles%\\\\CrawChat",
      "configRoot": "%CommonApplicationData%\\\\CrawChat\\\\default\\\\config",
      "dataRoot": "%CommonApplicationData%\\\\CrawChat\\\\default\\\\data",
      "logRoot": "%CommonApplicationData%\\\\CrawChat\\\\default\\\\logs",
      "runRoot": "%CommonApplicationData%\\\\CrawChat\\\\default\\\\run",
      "serviceManager": "windows-service",
      "startupCommand": "craw-chat-server --config <config-root>/server.yaml",
      "layoutTreePath": "artifacts/releases/wave-d-2026-04-08/server/packages/windows/artifacts/layout-tree.txt",
      "stagingReadmePath": "artifacts/releases/wave-d-2026-04-08/server/packages/windows/artifacts/README.md",
      "releaseChecklistPath": "artifacts/releases/wave-d-2026-04-08/server/packages/release-checklist.md",
      "checksumManifestPath": "artifacts/releases/wave-d-2026-04-08/server/packages/SHA256SUMS",
      "acceptanceManifestPath": "artifacts/releases/wave-d-2026-04-08/server/packages/windows/artifacts/acceptance-manifest.json",
      "state": "template_only_pending_build"
    },
    {
      "id": "windows-msi",
      "platform": "windows",
      "packageType": "msi",
      "fileNameTemplate": "craw-chat-server-<version>-x64.msi",
      "artifactPath": "artifacts/releases/wave-d-2026-04-08/server/packages/windows/artifacts/craw-chat-server-<version>-x64.msi",
      "installModel": "native-installer",
      "defaultInstallRoot": "%ProgramFiles%\\\\CrawChat",
      "configRoot": "%CommonApplicationData%\\\\CrawChat\\\\default\\\\config",
      "dataRoot": "%CommonApplicationData%\\\\CrawChat\\\\default\\\\data",
      "logRoot": "%CommonApplicationData%\\\\CrawChat\\\\default\\\\logs",
      "runRoot": "%CommonApplicationData%\\\\CrawChat\\\\default\\\\run",
      "serviceManager": "windows-service",
      "startupCommand": "craw-chat-server --config <config-root>/server.yaml",
      "layoutTreePath": "artifacts/releases/wave-d-2026-04-08/server/packages/windows/artifacts/layout-tree.txt",
      "stagingReadmePath": "artifacts/releases/wave-d-2026-04-08/server/packages/windows/artifacts/README.md",
      "releaseChecklistPath": "artifacts/releases/wave-d-2026-04-08/server/packages/release-checklist.md",
      "checksumManifestPath": "artifacts/releases/wave-d-2026-04-08/server/packages/SHA256SUMS",
      "acceptanceManifestPath": "artifacts/releases/wave-d-2026-04-08/server/packages/windows/artifacts/acceptance-manifest.json",
      "state": "template_only_pending_build"
    }
  ]
}
